{
  "$schema": "https://json-schema.org/draft/2020-12/schema",
  "$id": "plugin.schema.json",
  "title": "Plugin Manifest",
  "description": "Schema for plugin.json â€” Claude plugin manifest",
  "type": "object",
  "required": ["name", "description", "version"],
  "additionalProperties": true,
  "properties": {
    "name": {
      "type": "string",
      "pattern": "^[a-z][a-z0-9-]*$"
    },
    "description": {
      "type": "string"
    },
    "version": {
      "type": "string",
      "pattern": "^(0|[1-9]\\d*)\\.(0|[1-9]\\d*)\\.(0|[1-9]\\d*)(-[0-9A-Za-z-]+(\\.[0-9A-Za-z-]+)*)?(\\+[0-9A-Za-z-]+(\\.[0-9A-Za-z-]+)*)?$"
    },
    "author": {
      "type": "object",
      "additionalProperties": true,
      "properties": {
        "name": {
          "type": "string"
        },
        "url": {
          "type": "string",
          "format": "uri"
        }
      }
    },
    "repository": {
      "type": "string"
    }
  }
}
