{
  "name": "clarify",
  "description": "Unified requirement clarification: research-first with autonomous decision-making, or lightweight direct Q&A",
  "version": "2.0.1",
  "author": {
    "name": "Corca",
    "url": "https://www.corca.ai/"
  },
  "repository": "https://github.com/corca-ai/claude-plugins"
}
