{
  "name": "smart-read",
  "description": "A hook that enforces intelligent file reading based on file size â€” warns on medium files, blocks full reads on large files",
  "version": "1.0.0",
  "author": {
    "name": "Corca",
    "url": "https://www.corca.ai/"
  },
  "repository": "https://github.com/corca-ai/claude-plugins"
}
