{
  "name": "markdown-guard",
  "description": "A hook that validates markdown files after Write/Edit â€” reports lint violations so Claude self-corrects",
  "version": "1.0.0",
  "author": {
    "name": "Corca",
    "url": "https://www.corca.ai/"
  },
  "repository": "https://github.com/corca-ai/claude-plugins"
}
