{
  "name": "gather-context",
  "description": "Unified information acquisition: URL auto-detect (Google/Slack/Notion/GitHub/web), web search, and local codebase exploration",
  "version": "2.0.1",
  "author": {
    "name": "Corca",
    "url": "https://www.corca.ai/"
  },
  "repository": "https://github.com/corca-ai/claude-plugins"
}
