{
  "name": "attention-hook",
  "description": "Slack notifications with threading when Claude Code is waiting â€” idle alerts, AskUserQuestion prompts, plan mode approval, and periodic heartbeat status updates",
  "version": "2.1.0",
  "author": {
    "name": "Corca",
    "url": "https://www.corca.ai/"
  },
  "repository": "https://github.com/corca-ai/claude-plugins"
}
