{
  "name": "corca-claude-plugins",
  "description": "Claude Plugins for AI-Native Product Team - developed and managed by Corca",
  "version": "0.1.0",
  "author": {
    "name": "Corca",
    "url": "https://www.corca.ai/"
  },
  "repository": "https://github.com/corca-ai/public-agents-and-skills"
}
