{
  "name": "refactor",
  "description": "Multi-mode code and skill review: quick scan, deep skill review, holistic cross-plugin analysis, commit-based tidying, and docs consistency check",
  "version": "1.0.0",
  "author": {
    "name": "Corca",
    "url": "https://www.corca.ai/"
  },
  "repository": "https://github.com/corca-ai/claude-plugins"
}
