{
  "name": "cwf",
  "description": "Corca Workflow Framework — consolidated hooks and skill orchestration for structured development sessions",
  "version": "1.0.1",
  "author": {
    "name": "Corca",
    "url": "https://www.corca.ai/"
  },
  "repository": "https://github.com/corca-ai/claude-plugins"
}
