{
  "name": "deep-clarify",
  "description": "A skill that autonomously researches requirements through codebase exploration and best practice analysis, only asking humans about genuinely subjective decisions",
  "version": "1.0.0",
  "author": { "name": "Corca", "url": "https://www.corca.ai/" },
  "repository": "https://github.com/corca-ai/claude-plugins"
}
